<campus xmlns="http://www.sg.com"
	xmlns:xsi="http://www.w3.org/2001/XMLSchema-instance"
	xsi:schemaLocation="http://www.sg.com ../xsd/schema-online-campus.xsd">

	<students>
		<student id="101">
			<name>Sandro</name>
			<surname>Gargano</surname>
			<jobTitle></jobTitle>
			<paymentType>NOTOK</paymentType>
		</student>
		<student id="102">
			<name>Ermal</name>
			<surname>Aliraj</surname>
			<jobTitle></jobTitle>
			<paymentType>OK</paymentType>
		</student>
		<student id="103">
			<name>Armela</name>
			<surname>Xhaxho</surname>
			<jobTitle></jobTitle>
			<paymentType>UNKNOWN</paymentType>
		</student>
		<student id="104">
			<name>Aida</name>
			<surname>Xhaxho</surname>
			<jobTitle></jobTitle>
			<paymentType>OK</paymentType>
		</student>
		<student id="101">
			<name>Andrea</name>
			<surname>Fumagalli</surname>
			<jobTitle></jobTitle>
			<paymentType>OK</paymentType>
		</student>
		<student id="101">
			<name>Alessandro</name>
			<surname>Eramo</surname>
			<jobTitle></jobTitle>
			<paymentType>UNKNOWN</paymentType>
		</student>
	</students>
	<courses>
		<course id="201">
			<name>Java fundamentals</name>
			<description></description>
		</course>
		<course id="202">
			<name>Java advanced programming</name>
			<description></description>
		</course>
		<course id="203">
			<name>Operating Systems</name>
			<description></description>
		</course>
		<course id="204">
			<name>Computer Network</name>
			<description></description>
		</course>
		<course id="205">
			<name>Data Structures and Algorithms</name>
			<description></description>
		</course>
	</courses>
	<topics>
		<topic id="301">
			<name>Objects Oriented Paradigm</name>
			<description>OOPS concepts (Data Abstraction, Encapsulation, Inheritance, Polymorphism)</description>
			<course>201</course>
		</topic>
		<topic id="302">
			<name>Basic Java constructs like loops and data types</name>
			<description></description>
			<course>201</course>
		</topic>
		<topic id="303">
			<name>String handling</name>
			<description></description>
			<course>201</course>
		</topic>
		<topic id="304">
			<name>Collection framework</name>
			<description></description>
			<course>201</course>
		</topic>
		<topic id="305">
			<name>Exception handling</name>
			<description></description>
			<course>201</course>
		</topic>
		<topic id="306">
			<name>Servlet</name>
			<description></description>
			<course>202</course>
		</topic>
		<topic id="307">
			<name>JSP</name>
			<description></description>
			<course>202</course>
		</topic>
		<topic id="308">
			<name>What is an Operating System?</name>
			<description></description>
			<course>203</course>
		</topic>
		<topic id="309">
			<name>Operating System history</name>
			<description></description>
			<course>203</course>
		</topic>
		<topic id="310">
			<name>Operating System concepts</name>
			<description></description>
			<course>203</course>
		</topic>
		<topic id="311">
			<name>Operating System structures</name>
			<description></description>
			<course>203</course>
		</topic>
		<topic id="312">
			<name>Local Area Network (LAN) Technologies</name>
			<description></description>
			<course>204</course>
		</topic>
		<topic id="313">
			<name>Introduction of MAC Address</name>
			<description></description>
			<course>204</course>
		</topic>
		<topic id="314">
			<name>Multiple Access Protocols</name>
			<description></description>
			<course>204</course>
		</topic>
		<topic id="315">
			<name>Ethernet Frame Format</name>
			<description></description>
			<course>204</course>
		</topic>
		<topic id="316">
			<name>Basic Data Structures: Arrays, Strings, Stacks, Queues</name>
			<description></description>
			<course>205</course>
		</topic>
		<topic id="317">
			<name>Basic math operations (addition, subtraction, multiplication, division, exponentiation)</name>
			<description></description>
			<course>205</course>
		</topic>
		<topic id="318">
			<name>Euclid's GCD Algorithm</name>
			<description></description>
			<course>205</course>
		</topic>
		<topic id="319">
			<name>Greedy Algorithms</name>
			<description></description>
			<course>205</course>
		</topic>
		<topic id="320">
			<name>Binary Searching</name>
			<description></description>
			<course>205</course>
		</topic>
	</topics>
</campus>